{
 "_note": "v3.9.2 game content for realm 6 (Dawn Chapel), generated by build/world/make_realm_content.py. Same row shapes as GameDev's src/data enemies.json / locations.json / items.json for realms 1-2. Enemy id = Desy roster id (= desyId; graphs, zones.json and quests.json use it). Boss HP/ATK from data/boss_hp.csv. Placeholders GameDev owns: emoji, color, bg, headAnchor (0.1 default), sprite (no sheet yet: the id, i.e. emoji fallback), mech ({} = special text not coded yet), roster weights (1 each), altZh/altEn ([]). locations[].id = zones.json zone id; maxNewPerBattle = 3 (spec decision 17).",
 "schema": "realm_content/0.1",
 "version": "v3.9.2",
 "realm": 6,
 "title": {
  "en": "Dawn Chapel",
  "zh": "晨光小镇"
 },
 "G": 45,
 "maxNewPerBattle": 3,
 "enemies": [
  {
   "id": "zombie",
   "desyId": "zombie",
   "sprite": "zombie",
   "spriteTint": null,
   "headAnchor": 0.1,
   "zh": "丧尸",
   "py": "sàngshī",
   "en": "Zombie",
   "emoji": "🧟",
   "color": 6971261,
   "tier": 6,
   "level": 13,
   "kind": "normal",
   "role": "normal",
   "hp": 55,
   "atk": 23,
   "def_": 6,
   "exp": 90,
   "gold": 45,
   "chestRate": 0.1,
   "minions": [],
   "mech": {},
   "attackZh": "软绵绵抓",
   "attackEn": "Sniffly Grab",
   "special": "Cure: at 0 HP it isn’t destroyed; a puff of sparkly green mist clears and it turns back into a villager who says 谢谢! (same drops).",
   "group": "Groups of 3 that shuffle in slowly. They are sick villagers, not monsters.",
   "shoutZh": "我头疼",
   "shoutItem": "C403",
   "priority": "P2"
  },
  {
   "id": "rattle_skeleton",
   "desyId": "rattle_skeleton",
   "sprite": "rattle_skeleton",
   "spriteTint": null,
   "headAnchor": 0.1,
   "zh": "骷髅",
   "py": "kūlóu",
   "en": "Rattle Skeleton",
   "emoji": "💀",
   "color": 6971261,
   "tier": 6,
   "level": 14,
   "kind": "normal",
   "role": "normal",
   "hp": 43,
   "atk": 26,
   "def_": 7,
   "exp": 90,
   "gold": 45,
   "chestRate": 0.1,
   "minions": [],
   "mech": {},
   "attackZh": "骨头回旋镖",
   "attackEn": "Bone Boomerang",
   "special": "None.",
   "group": "Pairs that clatter in step. If one falls, the other stops to look for its bones (skips a turn).",
   "shoutZh": "找",
   "shoutItem": "C408",
   "priority": "P2"
  },
  {
   "id": "zombie_knight",
   "desyId": "zombie_knight",
   "sprite": "zombie_knight",
   "spriteTint": null,
   "headAnchor": 0.1,
   "zh": "丧尸骑士",
   "py": "sàngshī qíshì",
   "en": "Zombie Knight",
   "emoji": "⚔️",
   "color": 6971261,
   "tier": 6,
   "level": 16,
   "kind": "elite",
   "role": "elite",
   "hp": 96,
   "atk": 29,
   "def_": 6,
   "exp": 150,
   "gold": 90,
   "chestRate": 0.25,
   "minions": [],
   "mech": {},
   "attackZh": "瞌睡剑",
   "attackEn": "Sleepy Sword",
   "special": "Shield Up: every 3rd turn it raises its shield, halving the hero’s damage that round. It is cured at 0 HP like other zombies.",
   "group": "Alone or with 1 zombie. Scripted in L6.2; 10% rare patrol in Zombie Lands. It was the village guard captain.",
   "shoutZh": "我累了",
   "shoutItem": "C380",
   "priority": "P2"
  },
  {
   "id": "zombie_mayor",
   "desyId": "zombie_mayor",
   "sprite": "zombie_mayor",
   "spriteTint": null,
   "headAnchor": 0.1,
   "zh": "丧尸村长",
   "py": "sàngshī cūnzhǎng",
   "en": "Zombie Mayor",
   "emoji": "🎩",
   "color": 6971261,
   "tier": 6,
   "level": 14,
   "kind": "locboss",
   "role": "boss",
   "hp": 216,
   "atk": 23,
   "def_": 6,
   "exp": 300,
   "gold": 225,
   "chestRate": 1.0,
   "minions": [
    "zombie"
   ],
   "mech": {},
   "attackZh": "村长拐杖敲",
   "attackEn": "Mayor’s Cane Thump",
   "special": "Cure at 0 HP. When cured he gives the Village Key and tells you where the sickness came from.",
   "group": "Location boss of L6.1, with 1 zombie.",
   "shoutZh": "别担心",
   "shoutItem": "C383",
   "priority": "P2"
  },
  {
   "id": "sickness_fiend",
   "desyId": "sickness_fiend",
   "sprite": "sickness_fiend",
   "spriteTint": null,
   "headAnchor": 0.1,
   "zh": "病魔",
   "py": "bìngmó",
   "en": "Sickness Fiend",
   "emoji": "🦠",
   "color": 6971261,
   "tier": 6,
   "level": 17,
   "kind": "realmboss",
   "role": "boss",
   "hp": 185,
   "atk": 25,
   "def_": 6,
   "exp": 750,
   "gold": 450,
   "chestRate": 1.0,
   "minions": [
    "zombie",
    "zombie"
   ],
   "mech": {},
   "attackZh": "喷嚏云",
   "attackEn": "Sneezy Cloud",
   "special": "Germ Call: every 3 turns it calls 1 zombie if fewer than 3 enemies are on screen. Defeating it cures every zombie on screen at once.",
   "group": "Realm boss of Zombie Lands, a minion the Demon King sent to make the villagers sick. With 2 zombies.",
   "shoutZh": "生病",
   "shoutItem": "C398",
   "priority": "P2"
  }
 ],
 "locations": [
  {
   "id": "gloomy_village",
   "name": "Gloomy Village",
   "zh": "灰雾村",
   "emoji": "🕯️",
   "tier": 6,
   "G": 45,
   "recLevel": [
    13,
    16
   ],
   "enemiesPerBattle": [
    3,
    3
   ],
   "mcOptions": 5,
   "reviewSlots": 2,
   "pathFights": 8,
   "maxNewPerBattle": 3,
   "roster": [
    {
     "enemy": "zombie",
     "weight": 1
    }
   ],
   "boss": "zombie_mayor",
   "unlockRequires": [
    "hydra_s_lair"
   ],
   "bg": "0x6a5f7d",
   "bossReward": null,
   "packs": {},
   "scripted": {},
   "elite": "zombie_knight",
   "desyPool": "L6.1",
   "bossKind": "locboss",
   "bossNode": {
    "graph": "realm_6",
    "node": "boss_1"
   },
   "realm": 6
  },
  {
   "id": "moonlit_graveyard",
   "name": "Moonlit Graveyard",
   "zh": "月光墓园",
   "emoji": "🕯️",
   "tier": 6,
   "G": 45,
   "recLevel": [
    13,
    16
   ],
   "enemiesPerBattle": [
    3,
    3
   ],
   "mcOptions": 5,
   "reviewSlots": 2,
   "pathFights": 8,
   "maxNewPerBattle": 3,
   "roster": [
    {
     "enemy": "zombie",
     "weight": 1
    },
    {
     "enemy": "rattle_skeleton",
     "weight": 1
    }
   ],
   "boss": "sickness_fiend",
   "unlockRequires": [
    "gloomy_village"
   ],
   "bg": "0x6a5f7d",
   "bossReward": {
    "heroic": "cure_flask",
    "zh": "解药瓶",
    "en": "Cure Flask",
    "effect": "Heal +10%",
    "text": "Cure Flask 解药瓶 is yours!"
   },
   "packs": {},
   "scripted": {
    "4": [
     "zombie_knight"
    ]
   },
   "elite": "zombie_knight",
   "desyPool": "L6.2",
   "bossKind": "realmboss",
   "bossNode": {
    "graph": "moonlit_crypt_2",
    "node": "boss_6"
   },
   "realm": 6
  }
 ],
 "pools": {
  "gloomy_village": [
   "C357",
   "C358",
   "C359",
   "C360",
   "C361",
   "C362",
   "C363",
   "C364",
   "C365",
   "C366",
   "C367",
   "C368",
   "C369",
   "C370",
   "C371",
   "C378",
   "C379",
   "C380",
   "C381",
   "C382",
   "C383",
   "C384",
   "C385",
   "C386",
   "C828",
   "C829",
   "C830",
   "C831",
   "C832",
   "C833",
   "C834",
   "C835",
   "C836",
   "C837",
   "C838",
   "C839",
   "C840",
   "C841",
   "C842",
   "C843",
   "C387",
   "C388",
   "C389",
   "C390",
   "C391",
   "C392",
   "C393",
   "C394",
   "C395",
   "C396",
   "C397",
   "C398",
   "C399",
   "C400",
   "C401",
   "C402",
   "C403",
   "C404",
   "C405",
   "C406"
  ],
  "moonlit_graveyard": [
   "C844",
   "C845",
   "C846",
   "C847",
   "C848",
   "C849",
   "C850",
   "C851",
   "C852",
   "C853",
   "C854",
   "C855",
   "C856",
   "C857",
   "C858",
   "C859",
   "C860",
   "C861",
   "C862",
   "C407",
   "C408",
   "C409",
   "C410",
   "C411",
   "C412",
   "C413",
   "C414",
   "C415",
   "C416",
   "C417",
   "C418",
   "C419",
   "C420",
   "C421",
   "C422",
   "C863",
   "C864",
   "C865",
   "C866",
   "C867",
   "C868",
   "C869",
   "C870",
   "C871",
   "C872",
   "C873",
   "C874",
   "C875",
   "C876",
   "C877",
   "C878",
   "C879",
   "C880",
   "C881",
   "C882",
   "C883",
   "C884",
   "C885",
   "C547",
   "C424"
  ]
 },
 "items": [
  {
   "id": "C357",
   "zh": "高兴",
   "trad": "高興",
   "py": "gāoxìng",
   "en": "happy; glad",
   "enPrimary": "happy",
   "type": "word",
   "pos": "adj",
   "topic": "Feelings",
   "loc": "L6.1",
   "speaking": true,
   "reading": true,
   "slice": false,
   "altZh": [],
   "altEn": []
  },
  {
   "id": "C358",
   "zh": "开心",
   "trad": "開心",
   "py": "kāixīn",
   "en": "happy; having fun",
   "enPrimary": "happy",
   "type": "word",
   "pos": "adj",
   "topic": "Feelings",
   "loc": "L6.1",
   "speaking": true,
   "reading": true,
   "slice": false,
   "altZh": [],
   "altEn": []
  },
  {
   "id": "C359",
   "zh": "难过",
   "trad": "難過",
   "py": "nánguò",
   "en": "sad",
   "enPrimary": "sad",
   "type": "word",
   "pos": "adj",
   "topic": "Feelings",
   "loc": "L6.1",
   "speaking": true,
   "reading": true,
   "slice": false,
   "altZh": [],
   "altEn": []
  },
  {
   "id": "C360",
   "zh": "生气",
   "trad": "生氣",
   "py": "shēngqì",
   "en": "angry",
   "enPrimary": "angry",
   "type": "word",
   "pos": "adj",
   "topic": "Feelings",
   "loc": "L6.1",
   "speaking": true,
   "reading": true,
   "slice": false,
   "altZh": [],
   "altEn": []
  },
  {
   "id": "C361",
   "zh": "怕",
   "trad": "怕",
   "py": "pà",
   "en": "to be afraid (of)",
   "enPrimary": "to be afraid (of)",
   "type": "word",
   "pos": "verb",
   "topic": "Feelings",
   "loc": "L6.1",
   "speaking": true,
   "reading": true,
   "slice": false,
   "altZh": [],
   "altEn": []
  },
  {
   "id": "C362",
   "zh": "害怕",
   "trad": "害怕",
   "py": "hàipà",
   "en": "scared; to fear",
   "enPrimary": "scared",
   "type": "word",
   "pos": "verb",
   "topic": "Feelings",
   "loc": "L6.1",
   "speaking": true,
   "reading": true,
   "slice": false,
   "altZh": [],
   "altEn": []
  },
  {
   "id": "C363",
   "zh": "累",
   "trad": "累",
   "py": "lèi",
   "en": "tired",
   "enPrimary": "tired",
   "type": "word",
   "pos": "adj",
   "topic": "Feelings",
   "loc": "L6.1",
   "speaking": true,
   "reading": true,
   "slice": false,
   "altZh": [],
   "altEn": []
  },
  {
   "id": "C364",
   "zh": "困",
   "trad": "困",
   "py": "kùn",
   "en": "sleepy",
   "enPrimary": "sleepy",
   "type": "word",
   "pos": "adj",
   "topic": "Feelings",
   "loc": "L6.1",
   "speaking": true,